{
  "$schema": "https://json-schema.org/draft/2020-12/schema",
  "$id": "https://structura-reditus.org/schema/source.schema.json",
  "title": "Structura Reditus Research Library — Source Record",
  "description": "A source object. External work remains an external source object with preserved authorship, source-native claims, source identity, and missingness. A source is never rewritten into a local interpretation.",
  "type": "object",
  "additionalProperties": false,
  "required": ["source_id", "source_type", "title", "source_authors", "missingness"],
  "properties": {
    "source_id": {
      "type": "string",
      "pattern": "^SRC-[0-9]{6}$",
      "description": "Stable source identifier, e.g. SRC-000001."
    },
    "source_type": {
      "type": "string",
      "enum": ["external", "corpus-native", "dataset", "historical"],
      "description": "external: work outside Structura Reditus; corpus-native: work inside the SR corpus; dataset: a dataset source; historical: a historical document source."
    },
    "title": { "type": "string", "minLength": 1 },
    "source_authors": {
      "type": "array",
      "minItems": 1,
      "items": { "type": "string", "minLength": 1 },
      "description": "Original authorship exactly as attributable. Never replaced by a library AuthorID for external work."
    },
    "source_native_claims": {
      "type": "array",
      "items": { "type": "string", "minLength": 1 },
      "description": "Claims the source itself makes, in the source's own terms. Local interpretation is never placed here."
    },
    "identifier": {
      "type": "object",
      "additionalProperties": false,
      "description": "External identity of the source (DOI, URL, ISBN, archive reference). Only supplied values; never guessed.",
      "properties": {
        "doi": { "type": "string" },
        "url": { "type": "string" },
        "isbn": { "type": "string" },
        "archive_reference": { "type": "string" },
        "other": { "type": "string" }
      }
    },
    "publication_year": {
      "type": ["integer", "null"],
      "description": "Publication year if known; null preserves missingness."
    },
    "venue": { "type": ["string", "null"] },
    "links": {
      "type": "array",
      "description": "Labeled outbound resources. The original work stays on its DOI/archive platform; the library never mirrors it. At most one link per source may be preferred. Link failure never deletes a source; DOI identity survives a broken web link. Full-text, code, data, and supplement URLs are never guessed.",
      "items": {
        "type": "object",
        "additionalProperties": false,
        "required": ["label", "type", "url", "preferred"],
        "properties": {
          "label": { "type": "string", "minLength": 1 },
          "type": {
            "type": "string",
            "enum": ["canonical", "archive", "full_text", "publisher", "code", "data", "supplement", "project_page"]
          },
          "url": { "type": "string", "format": "uri", "pattern": "^https?://" },
          "preferred": { "type": "boolean" }
        }
      }
    },
    "missingness": {
      "type": "array",
      "items": { "type": "string", "minLength": 1 },
      "description": "Explicit list of unavailable metadata or evidence. Preserved, never silently filled."
    },
    "version": {
      "type": ["string", "null"],
      "description": "Version or edition of the named work exactly as the source states it (e.g. '2.0', 'v2.1.5'). Null when the source states none."
    },
    "status": {
      "type": "string",
      "enum": ["active", "superseded", "historical"],
      "default": "active",
      "description": "active: current source state for this named work; superseded: a later source record (superseded_by) is the current state; historical: prefreeze/lineage witness kept as evidence."
    },
    "concept_doi": {
      "type": ["string", "null"],
      "pattern": "^10\\.[0-9]{4,9}/\\S+$",
      "description": "Archive concept DOI that resolves to the latest deposited version (e.g. a Zenodo concept DOI). Source identity != archive concept != deposited version."
    },
    "version_doi": {
      "type": ["string", "null"],
      "pattern": "^10\\.[0-9]{4,9}/\\S+$",
      "description": "DOI of the specific deposited version this record refers to."
    },
    "related_dois": {
      "type": "array",
      "uniqueItems": true,
      "items": {
        "type": "object",
        "additionalProperties": false,
        "required": ["doi", "relation"],
        "properties": {
          "doi": { "type": "string", "pattern": "^10\\.[0-9]{4,9}/\\S+$" },
          "relation": {
            "type": "string",
            "enum": ["earlier_version", "later_version", "alternate_record", "shared_archive", "first_edition", "external_metadata", "software", "other"]
          },
          "notes": { "type": "string" }
        }
      },
      "description": "Other DOIs observed for this work, each typed. Preserves lineage without collapsing concept, version, or alternate records into one identifier."
    },
    "supersedes": {
      "type": "array",
      "uniqueItems": true,
      "items": { "type": "string", "pattern": "^SRC-[0-9]{6}$" },
      "description": "Earlier source records (SRC-*) whose state this record supersedes; the earlier records are preserved."
    },
    "superseded_by": {
      "type": ["string", "null"],
      "pattern": "^SRC-[0-9]{6}$"
    },
    "notes": { "type": "string" }
  }
}
