{
  "source_id": "SRC-000056",
  "source_type": "corpus-native",
  "status": "active",
  "title": "Contract-First Epistemology: Semester I — Method Internalization (Weeks 1–14)",
  "version": "Course Architecture v1.0",
  "source_authors": [
    "Clement Paulus"
  ],
  "source_native_claims": [
    "Governing Semester Question (source-stated): What must be declared before judgment becomes evaluable?",
    "Instructional burden (source-stated): make judgment evaluable before students are asked to handle return, ledger reconciliation, diagnostics, domain transfer, critique, or final casepack defense; Weeks 1–14 begin with ordinary judgment and end with the first complete mini-pass.",
    "Dated May 6, 2026, Course Architecture v1.0, prepared by Clement Paulus."
  ],
  "identifier": {
    "doi": "10.5281/zenodo.20074210",
    "url": "https://doi.org/10.5281/zenodo.20074210"
  },
  "concept_doi": "10.5281/zenodo.20074209",
  "version_doi": "10.5281/zenodo.20074210",
  "related_dois": [],
  "supersedes": [],
  "superseded_by": null,
  "publication_year": 2026,
  "venue": "Zenodo",
  "links": [
    {
      "label": "Canonical DOI",
      "type": "canonical",
      "url": "https://doi.org/10.5281/zenodo.20074210",
      "preferred": true
    },
    {
      "label": "Zenodo Archive",
      "type": "archive",
      "url": "https://zenodo.org/records/20074210",
      "preferred": false
    }
  ],
  "missingness": [
    "No separate DOI or record description for this member work; the archive description describes the full course."
  ],
  "notes": "Member work of the shared Zenodo archive 10.5281/zenodo.20074210 (concept 10.5281/zenodo.20074209, resource type Lesson, 2026-05-06), whose file listing is: 'Contract First Epistemology.pdf' (full course, SRC-000055), 'semester_1.pdf' (SRC-000056), 'semester_2.pdf' (SRC-000057), 'course syllabus and audit receipt.pdf' (SRC-000058), and 'course_layout.pdf' (course layout; not registered separately). The SourceID identifies the named member work; the DOI identifies the archive (SEAM-0008 policy). This record is the member file 'semester_1.pdf'. Zenodo verification (2026-09-13, API metadata): record 20074210, title \"Contract-First Epistemology: Semester I — Method Internalization\", creators ['Paulus, Clement'], publication date 2026-05-06, resource type Lesson."
}
