{
  "source_id": "SRC-000015",
  "source_type": "corpus-native",
  "status": "active",
  "title": "Generative Collapse Dynamics (UMCP/GCD): Enabling Cross-Domain Comparability via Contract-Frozen Kernel Invariants and Typed Return",
  "version": "release line v2.1.5",
  "source_authors": [
    "Clement Paulus"
  ],
  "source_native_claims": [
    "Presents GCD as a contract-first measurement discipline governed by a single admissibility axiom: collapse is generative; only what returns through collapse is real — where \"real\" is an audit rule, not a metaphysical claim.",
    "Formalizes the Tier-1 kernel ledger (F, ω, S, C, κ, IC, typed return delay τ_R) and proves the identities F+ω=1, IC≤F, IC=exp(κ)."
  ],
  "identifier": {
    "doi": "10.5281/zenodo.18819238",
    "url": "https://doi.org/10.5281/zenodo.18819238",
    "other": "Earlier version DOI 10.5281/zenodo.18819239 (v2.1.3, 2026-02-28) is historical version metadata under the canonical concept DOI; see related_dois."
  },
  "concept_doi": "10.5281/zenodo.18819238",
  "version_doi": "10.5281/zenodo.18893328",
  "related_dois": [
    {
      "doi": "10.5281/zenodo.18819239",
      "relation": "earlier_version",
      "notes": "v2.1.3 version record (2026-02-28) under the concept DOI; exposed by ResearchGate metadata. Historical version metadata only."
    },
    {
      "doi": "10.5281/zenodo.18616616",
      "relation": "software",
      "notes": "Zenodo software DOI named on the whitepaper title page."
    }
  ],
  "supersedes": [],
  "superseded_by": null,
  "publication_year": 2026,
  "venue": "Zenodo",
  "links": [
    {
      "label": "Canonical DOI",
      "type": "canonical",
      "url": "https://doi.org/10.5281/zenodo.18819238",
      "preferred": true
    },
    {
      "label": "Zenodo Archive",
      "type": "archive",
      "url": "https://zenodo.org/records/18893328",
      "preferred": false
    },
    {
      "label": "Reference implementation (GitHub)",
      "type": "code",
      "url": "https://github.com/calebpruett927/GENERATIVE-COLLAPSE-DYNAMICS",
      "preferred": false
    }
  ],
  "missingness": [],
  "notes": "Registry role: FOUNDATIONAL / OPERATIONAL SOURCE ONLY; no Tier-2 object is created from the foundational whitepaper. Code link taken from the repository named in the Zenodo record description. DOI lineage (SEAM-0009, closed): 10.5281/zenodo.18819238 is the concept DOI and the library's canonical anchor; 10.5281/zenodo.18819239 is the earlier v2.1.3 version record (2026-02-28) and is kept only as historical version metadata in related_dois; the latest version record at verification (2026-09-13) is 10.5281/zenodo.18893328 (v2.1.5, 2026-03-05). Zenodo verification (2026-09-13): DOI 10.5281/zenodo.18819238 is a concept DOI (resolves to the latest version); resolved record 18893328, record title \"Generative Collapse Dynamics (UMCP/GCD): Enabling Cross-Domain Comparability via Contract-Frozen Kernel Invariants and Typed Return\", creators ['Paulus, Clement'], publication date 2026-03-05, resource type Report."
}
