{
  "source_id": "SRC-000005",
  "source_type": "corpus-native",
  "status": "active",
  "title": "RCFT Operating System: Discovery, Candidate Maturity, and Generative Field-Hypothesis Discipline",
  "version": "v1.0.0 (packet)",
  "source_authors": [
    "Clement Paulus"
  ],
  "source_native_claims": [
    "Source-of-truth reference for Recursive Collapse Field Theory (RCFT) as the discovery and exploration operating system of Generative Collapse Dynamics."
  ],
  "identifier": {
    "doi": "10.5281/zenodo.21212668",
    "url": "https://doi.org/10.5281/zenodo.21212668"
  },
  "concept_doi": "10.5281/zenodo.21212667",
  "version_doi": "10.5281/zenodo.21212668",
  "related_dois": [],
  "supersedes": [],
  "superseded_by": null,
  "publication_year": 2026,
  "venue": "Zenodo",
  "links": [
    {
      "label": "Canonical DOI",
      "type": "canonical",
      "url": "https://doi.org/10.5281/zenodo.21212668",
      "preferred": true
    },
    {
      "label": "Zenodo Archive",
      "type": "archive",
      "url": "https://zenodo.org/records/21212668",
      "preferred": false
    }
  ],
  "missingness": [
    "Archive file listing gives the expanded title \"Recursive Collapse Field Theory Operating System: Discovery, Candidate Maturity, and Generative Field-Hypothesis Discipline\" (RCFT_Operating_System.pdf)."
  ],
  "notes": "Registry role: FUNCTIONAL SOURCE SPECIFICATION ONLY; no Tier-2 object. Shared archive DOI 10.5281/zenodo.21212668 for the coordinated four-paper source-specification release (SRC-000002, SRC-000003, SRC-000004, SRC-000005). The SourceID identifies the named member work; the DOI identifies the archive. Member works are not collapsed into one object and the shared DOI is not counted as multiple deposits. Membership verified from the archive's file listing. Zenodo verification (2026-09-13): DOI 10.5281/zenodo.21212668 is a version DOI; resolved record 21212668, record title \"Structura Reditus / GCD Coordinated Four-Paper Release\", creators ['Paulus, Clement'], publication date 2026-07-05, resource type Publication."
}
