{
  "source_id": "SRC-000029",
  "source_type": "historical",
  "status": "historical",
  "title": "Universal Collapse Diagnostics: Contract-First Invariants, κ-Continuous Calculus, and Cross-Domain Audit",
  "version": "v1.0.1",
  "source_authors": [
    "Clement Paulus"
  ],
  "source_native_claims": [],
  "identifier": {
    "doi": "10.5281/zenodo.17173112",
    "url": "https://doi.org/10.5281/zenodo.17173112"
  },
  "concept_doi": "10.5281/zenodo.17173112",
  "version_doi": "10.5281/zenodo.17181872",
  "related_dois": [],
  "supersedes": [],
  "superseded_by": null,
  "publication_year": 2025,
  "venue": "Zenodo",
  "links": [
    {
      "label": "Canonical DOI",
      "type": "canonical",
      "url": "https://doi.org/10.5281/zenodo.17173112",
      "preferred": true
    },
    {
      "label": "Zenodo Archive",
      "type": "archive",
      "url": "https://zenodo.org/records/17181872",
      "preferred": false
    }
  ],
  "missingness": [
    "Zenodo record title is the short form \"Universal Collapse Diagnostics\"; no public abstract on the record (files: Universal Collapse Diagnostics.pdf, Unified First Law of Collapse.pdf, ledger CSV, figures).",
    "Source-native claims not captured in this import pass; only identity, archive, and classification metadata are recorded."
  ],
  "notes": "Historical / prefreeze lineage source. Historical terminology is preserved as source evidence and does not overwrite the mature Structura Reditus architecture. Zenodo verification (2026-09-13): DOI 10.5281/zenodo.17173112 is a concept DOI (resolves to the latest version); resolved record 17181872, record title \"Universal Collapse Diagnostics\", creators ['Paulus, Clement'], publication date 2025-09-23, resource type Book."
}
