{
  "source_id": "SRC-000035",
  "source_type": "corpus-native",
  "status": "active",
  "title": "Reditus & Structura Reditus: Field Constitution & Core-Object Formalization for Admissible Return Through Collapse",
  "version": null,
  "source_authors": [
    "Clement Paulus"
  ],
  "source_native_claims": [
    "Structura Reditus is the field devoted to Reditus: the admissible return of structure through collapse under declared conditions; its governing axiom is Axiom-0: collapse is generative; only what returns through collapse is real.",
    "A structure receives epistemic, operational, or ontological credit only when it undergoes collapse or perturbation and re-enters admissible structure under the same declared rule-set; collapse alone and survival alone are insufficient.",
    "Tier-1 reserves the immutable kernel symbols and identities; Tier-0 governs contracts, validators, closures, ledgers, seam accounting, and stance derivation; Tier-2 translates domains into evaluable closure form without redefining the kernel."
  ],
  "identifier": {
    "archive_reference": "Handoff bundle SR_LIBRARY_GOVERNING_CORE_HANDOFF_v1_0, file 01_CANON_CONSTITUTION/Reditus_and_Structura_Reditus.pdf, sha256 4aa6a8d8f4d631e185d63c0bd50b8704e257d49437ad0e392dca0071460af0f3. Full text supplied to the library maintainer; not deposited in this repository."
  },
  "concept_doi": null,
  "version_doi": null,
  "related_dois": [],
  "supersedes": [],
  "superseded_by": null,
  "publication_year": 2026,
  "venue": null,
  "links": [],
  "missingness": [
    "No DOI or public archive deposit is established by the supplied source; identity is anchored to the handoff bundle file hash. Do not guess a DOI."
  ],
  "notes": "Dated June 2026 (title page). Constitutional work; see SR-GOV-000002."
}
