{
  "source_id": "SRC-000010",
  "source_type": "corpus-native",
  "status": "active",
  "title": "The Periodic Table as a Measured Object: Tier-1 Derivation from Atomic Properties in the GCD Kernel",
  "version": null,
  "source_authors": [
    "Clement Paulus"
  ],
  "source_native_claims": [
    "Treats all 118 elements as one fixed measured object under a frozen 8-channel atomic closure and asks what structure the GCD/UMCP kernel recovers from standard atomic properties alone.",
    "The paper does not attempt to replace chemistry; its distinct burden is to make the entire table answerable as one explicit measured object under one published comparison surface.",
    "Under the frozen closure all 118 rows satisfy the identities F+ω=1, IC≤F, IC=e^κ; at corpus scale 111 rows are in Collapse, 7 in Watch, 0 in Stable."
  ],
  "identifier": {
    "doi": "10.5281/zenodo.19639656",
    "url": "https://doi.org/10.5281/zenodo.19639656"
  },
  "concept_doi": "10.5281/zenodo.19639655",
  "version_doi": "10.5281/zenodo.19639656",
  "related_dois": [],
  "supersedes": [],
  "superseded_by": null,
  "publication_year": 2026,
  "venue": "Zenodo",
  "links": [
    {
      "label": "Canonical DOI",
      "type": "canonical",
      "url": "https://doi.org/10.5281/zenodo.19639656",
      "preferred": true
    },
    {
      "label": "Zenodo Archive",
      "type": "archive",
      "url": "https://zenodo.org/records/19639656",
      "preferred": false
    }
  ],
  "missingness": [],
  "notes": "Title preserved exactly as published; \"Tier-1 Derivation\" is the source's own wording. The Research Library object built on this source (SR-OBJ-000005) is Tier-2. Zenodo verification (2026-09-13): DOI 10.5281/zenodo.19639656 is a version DOI; resolved record 19639656, record title \"The Periodic Table as a Measured Object: Tier-1 Derivation from Atomic Properties in the GCD Kernel\", creators ['Paulus, Clement'], publication date 2026-04-17, resource type Report."
}
