{
  "source_id": "SRC-000008",
  "source_type": "corpus-native",
  "status": "active",
  "title": "Generative Collapse Dynamics / UMCP: The Pass — A Complete Worked Traversal from Frozen Contract to Derived Stance",
  "version": "v1.0.1 (packet)",
  "source_authors": [
    "Clement Paulus"
  ],
  "source_native_claims": [
    "Part III, The Pass, completes the sequence by walking one object through the full discipline from frozen contract to derived stance, so that the framework can be seen as a repeatable procedure."
  ],
  "identifier": {
    "doi": "10.5281/zenodo.19637774",
    "url": "https://doi.org/10.5281/zenodo.19637774"
  },
  "concept_doi": "10.5281/zenodo.19622272",
  "version_doi": "10.5281/zenodo.19637774",
  "related_dois": [],
  "supersedes": [],
  "superseded_by": null,
  "publication_year": 2026,
  "venue": "Zenodo",
  "links": [
    {
      "label": "Canonical DOI",
      "type": "canonical",
      "url": "https://doi.org/10.5281/zenodo.19637774",
      "preferred": true
    },
    {
      "label": "Zenodo Archive",
      "type": "archive",
      "url": "https://zenodo.org/records/19637774",
      "preferred": false
    }
  ],
  "missingness": [],
  "notes": "Orientation Series, Part III of III. Shared archive DOI 10.5281/zenodo.19637774 for Orientation Series Parts I-III (SRC-000006, SRC-000007, SRC-000008). The SourceID identifies the named part; the DOI identifies the archive. Membership verified from the archive's file listing (Part I/II/III PDFs). Zenodo verification (2026-09-13): DOI 10.5281/zenodo.19637774 is a version DOI; resolved record 19637774, record title \"Generative Collapse Dynamics / UMCP: Orientation Series (Parts I–III)\", creators ['Paulus, Clement'], publication date 2026-04-16, resource type Lesson."
}
