{
  "source_id": "SRC-000050",
  "source_type": "corpus-native",
  "status": "active",
  "title": "Recursive Accelerating Return: A Generative Collapse Dynamics Theory of Endogenous Generative Capacity",
  "version": "GCD-RAR.2026-08-26",
  "source_authors": [
    "Clement Paulus"
  ],
  "source_native_claims": [
    "Recursive Accelerating Return (RAR) is formulated as a derived regime of Generative Collapse Dynamics; it does not redefine the Tier-1 UMCP kernel (source-stated publication status).",
    "The claim is conditional: if structure survives collapse, returns admissibly, alters the next generator under a declared equivalence rule, has a positive identified effect on later productive capacity, and the positive log-gain per unit elapsed inter-return time increases across successive admissible returns, then the trajectory belongs to a RAR solution class of GCD.",
    "Showing that inheritance caused the rate increase requires an additional longitudinal counterfactual; the classification does not by itself establish causal RAR.",
    "The study-level contract GCD.RAR.CORE freezes the cycle boundary, admissible return domain, canonical return test, inter-return interval rule, capacity functional, resource normalization, operator-equivalence rule, causal capacity test, model-comparison rule, uncertainty policy, and any exogenous-exposure policy; a domain implementation must additionally declare a Tier-2 mapping contract GCD.RAR.MAP.<domain>.",
    "Evidence boundary (source-stated): formal theory, synthetic operational demonstrations, and a prospective falsification design are included; no empirical validation of RAR is claimed."
  ],
  "identifier": {
    "doi": "10.5281/zenodo.22035775",
    "url": "https://doi.org/10.5281/zenodo.22035775"
  },
  "concept_doi": "10.5281/zenodo.22035775",
  "version_doi": "10.5281/zenodo.22121149",
  "related_dois": [
    {
      "doi": "10.5281/zenodo.22036337",
      "relation": "earlier_version",
      "notes": "Version record v1, 2026-08-16, under the same concept."
    },
    {
      "doi": "10.5281/zenodo.22064156",
      "relation": "earlier_version",
      "notes": "Version record 2026-08-22, under the same concept."
    },
    {
      "doi": "10.5281/zenodo.22087426",
      "relation": "earlier_version",
      "notes": "Version record 2026-08-24, under the same concept."
    },
    {
      "doi": "10.5281/zenodo.22118835",
      "relation": "earlier_version",
      "notes": "Version record 2026-08-26 (superseded the same day by 22121149), under the same concept."
    }
  ],
  "supersedes": [],
  "superseded_by": null,
  "publication_year": 2026,
  "venue": "Zenodo",
  "links": [
    {
      "label": "Canonical DOI",
      "type": "canonical",
      "url": "https://doi.org/10.5281/zenodo.22035775",
      "preferred": true
    },
    {
      "label": "Zenodo Archive",
      "type": "archive",
      "url": "https://zenodo.org/records/22121149",
      "preferred": false
    }
  ],
  "missingness": [
    "The Zenodo record carries the short title \"Recursive Accelerating Return\" and no version label; the full title and Publication ID GCD-RAR.2026-08-26 are taken from the manuscript front matter."
  ],
  "notes": "Corpus-native theory paper; the manuscript states DOI 10.5281/zenodo.22035775 (the concept DOI), Publication ID GCD-RAR.2026-08-26, date August 26, 2026, evidence cutoff August 22, 2026. SEAM-0021 recorded this DOI as not resolvable on the first 2026-09-13 check; on re-verification later the same day it resolves to the concept record whose latest version is 22121149 (2026-08-26). Earlier version deposits under the concept are typed below. Zenodo verification (2026-09-13, API metadata): record 22121149, title \"Recursive Accelerating Return: A Generative Collapse Dynamics Theory of Endogenous Generative Capacity\", creators ['Paulus, Clement'], publication date 2026-08-26, resource type Publication."
}
