{
  "source_id": "SRC-000044",
  "source_type": "corpus-native",
  "title": "GCD / UMCP — Entering the Corpus: Ingress, Publication Architecture, and Guided Routes",
  "source_authors": [
    "Clement Paulus"
  ],
  "source_native_claims": [
    "States the publication architecture of the corpus, assigns each major paper family one primary burden, publishes decision rules for route choice, and formalizes the casepack ladder that follows The First Pass.",
    "The paper is companion rather than constitutional: it does not replace the Orientation Series, restate the full constitutional derivation, replace continuity or weld papers, or compete with closure papers on domain substance."
  ],
  "identifier": {
    "archive_reference": "Handoff bundle SR_LIBRARY_GOVERNING_CORE_HANDOFF_v1_0, file 04_INGRESS_CONTACT/Ingress_Publication_Architecture_and_Guided_Routes.pdf, sha256 61deb14712bfae3ac6a023b3bd3a3c9d1b58c3b55fa0ec3640a0afbe35257bb4. Full text supplied to the library maintainer; not deposited in this repository."
  },
  "publication_year": 2026,
  "venue": null,
  "links": [],
  "missingness": [
    "No DOI or public archive deposit is established by the supplied source; identity is anchored to the handoff bundle file hash. Do not guess a DOI."
  ],
  "notes": "Dated April 20, 2026. See SR-GOV-000017."
}
